{
  "id": "limit-intuition",
  "chapterId": "limits",
  "number": "2.1",
  "title": "极限：靠近时会怎样",
  "subtitle": "一个孔洞，为什么不妨碍极限？",
  "concept": "极限问的是：$x$ 靠近 $a$ 时，$f (x)$ 靠近哪个数？点上的值可以不同，甚至没有定义。",
  "intuition": "对 $\\frac{x^{2} - 1}{x - 1}$，只要 $x \\ne 1$ 就等于 $x + 1$。$x$ 从两边靠近 1，输出都靠近 2；分式在 1 无定义，不妨碍这个极限。",
  "objectives": [
    "先看附近，再看点上",
    "左右必须相遇",
    "图和表格的作用"
  ],
  "body": [
    {
      "title": "能不能直接代入？",
      "text": "连续时可以。若代入得到 $\\frac{0}{0}$，要先化简或分析附近的值；$\\frac{0}{0}$ 不是答案。"
    },
    {
      "title": "左右不一样怎么办？",
      "text": "双侧极限要求左右极限相等。例如零点左侧为 −1、右侧为 1，双侧极限不存在，不能取平均。"
    },
    {
      "title": "看图就能确定吗？",
      "text": "图和数值表能帮助猜测，不能证明。$\\sin (\\frac{1}{x})$ 在零附近不断振荡；放大或增加有限样点也不能代替极限定义。"
    }
  ],
  "formalDefinition": {
    "text": "双侧极限是左右两个靠近过程的共同输出趋势。",
    "latex": "\\lim_{x\\to a}f(x)=L\\iff \\lim_{x\\to a^-}f(x)=\\lim_{x\\to a^+}f(x)=L",
    "conditions": [
      "这里讨论有限实数极限；左右需有可接近的定义域点。"
    ]
  },
  "derivation": [
    {
      "text": "分解分子，但保留原函数的孔洞。",
      "latex": "\\frac{x^2-1}{x-1}=x+1\\quad(x\\ne1)"
    },
    {
      "text": "附近输出沿直线靠近 2。",
      "latex": "\\lim_{x\\to1}(x+1)=2"
    },
    {
      "text": "约掉因子是在附近建立等式，不是在 $x = 1$ 处强行定义原分式。",
      "latex": null
    }
  ],
  "interactiveVisual": {
    "kind": "limit",
    "function": "hole",
    "a": 1,
    "caption": "从左右让 $x$ 靠近 1。空心点说明原函数在 1 无定义，输出仍趋近 2。",
    "prediction": "有孔洞就没有极限吗？再切换到左右不同的图，两种情形差在哪里？"
  },
  "workedExamples": [
    {
      "title": "有孔洞的直线",
      "problem": "求 $\\lim_{x\\to2}\\frac{x^2-4}{x-2}$。",
      "steps": [
        "在 $x \\ne 2$ 时约去 $x - 2$，得到 $x + 2$。",
        "左右都趋近 4。"
      ],
      "answer": "极限为 4，原函数在 2 无定义。"
    },
    {
      "title": "左右不相同",
      "problem": "$f(x)=-1$（$x < 0$），$f(x)=1$（$x \\ge 0$）。求零点附近的极限。",
      "steps": [
        "左侧一直为 −1，右侧一直为 1。",
        "左右极限不同；改变 $f (0)$ 也不会让它们相等。"
      ],
      "answer": "左极限 −1，右极限 1，双侧极限不存在。"
    }
  ],
  "commonMistakes": [
    {
      "id": "limit-intuition-m1",
      "claim": "把 $\\frac{0}{0}$ 当成极限为 0。",
      "correction": "$\\frac{0}{0}$ 是未定式，表示需要进一步分析。"
    },
    {
      "id": "limit-intuition-m2",
      "claim": "觉得有极限就必须在该点连续。",
      "correction": "连续还要函数值存在且等于极限。"
    }
  ],
  "practice": [
    {
      "id": "limit-intuition-p1",
      "difficulty": 1,
      "misconceptionTags": [],
      "problem": "求 $\\lim_{x\\to3}(x+2)$。",
      "answer": "$5$。",
      "solution": [
        "线性函数附近的输出趋近 $3 + 2$。"
      ],
      "hint": "可以直接代入连续函数。",
      "numericAnswer": 5
    },
    {
      "id": "limit-intuition-p2",
      "difficulty": 2,
      "misconceptionTags": [
        "limit-intuition-m1"
      ],
      "problem": "求 $\\lim_{x\\to1}\\frac{x^2-1}{x-1}$。",
      "answer": "$2$。",
      "solution": [
        "$x \\ne 1$ 时约分为 $x + 1$。"
      ],
      "hint": "先分解平方差。",
      "numericAnswer": 2
    },
    {
      "id": "limit-intuition-p3",
      "difficulty": 1,
      "misconceptionTags": [],
      "problem": "若左右极限分别为 2 和 3，双侧极限存在吗？",
      "answer": "不存在。",
      "solution": [
        "双侧极限要求两侧同值。"
      ],
      "hint": "不能求两侧的平均值。"
    },
    {
      "id": "limit-intuition-p4",
      "difficulty": 2,
      "misconceptionTags": [
        "limit-intuition-m2"
      ],
      "problem": "把 $f(1)$ 从 2 改为 100，会改变 $\\lim_{x\\to1}(x+1)$ 的趋势吗？",
      "answer": "不会，极限仍为 2。",
      "solution": [
        "极限考察穿孔邻域，单点改动不影响。"
      ],
      "hint": "$x$ 接近 1 但不等于 1。"
    },
    {
      "id": "limit-intuition-transfer",
      "problem": "当 $x\\ne2$ 时 $f(x)=x^2$，而 $f(2)=7$。求 $\\lim_{x\\to2}f(x)$，并说明函数是否在 2 连续。",
      "answer": "极限为 4；不连续。",
      "solution": [
        "去心邻域中函数等于平方函数，极限是 $2^2=4$。",
        "点值 7 与极限 4 不同，不满足连续条件。"
      ],
      "hint": "先分开写附近趋势与点值。",
      "difficulty": 4,
      "misconceptionTags": [
        "limit-intuition-m2"
      ]
    }
  ],
  "prerequisites": [
    "domain",
    "transformations"
  ],
  "difficulty": 2,
  "misconceptionTags": [
    "limit-intuition-m1",
    "limit-intuition-m2"
  ],
  "provenance": {
    "author": "AI-generated",
    "version": "0.3.4",
    "status": "revised",
    "humanReviewed": false
  },
  "sources": [
    "openstax-calculus-1",
    "active-calculus-2",
    "ies-learning",
    "phet-design",
    "3b1b-calculus"
  ],
  "learningCheck": {
    "question": "只把 $f (1)$ 改成 100，会改变 $x \\to 1$ 时的极限吗？",
    "choices": [
      "一定变成 100",
      "只要两侧极限存在且相同，就不会改变",
      "极限一定不存在"
    ],
    "correctIndex": 1,
    "explanation": "极限检查 1 附近、但不等于 1 的输入。单独改变点上的值不会改变两侧的趋势。",
    "responses": [
      {
        "text": "点值只规定恰好在这一点的输出。极限看附近输入的输出，不把中心点代进去。",
        "experimentStep": 1
      },
      {
        "text": "极限检查 1 附近、但不等于 1 的输入。单独改变点上的值不会改变两侧的趋势。",
        "experimentStep": null
      },
      {
        "text": "单点被改动，不会自动破坏附近的共同趋势。先分别看左右，再判断是否趋向同一个数。",
        "experimentStep": 1
      }
    ]
  },
  "teaching": {
    "explain": "把到达某点和靠近某点分开。极限看附近输出的趋势；点本身缺着一个洞，也可以有稳定趋势。",
    "steps": [
      {
        "title": "先看右侧",
        "instruction": "从右侧距目标 0.5 的位置观察。",
        "preset": {
          "h": 0.5,
          "side": 1,
          "comparison": "original"
        },
        "observation": "$x=1.5$ 时输出为 2.5。"
      },
      {
        "title": "从左侧靠近",
        "instruction": "改成左侧，距离缩到 0.01。",
        "preset": {
          "h": 0.01,
          "side": -1,
          "comparison": "original"
        },
        "observation": "左侧输出为 1.99；再看右侧是 2.01，两边都靠近 2。"
      },
      {
        "title": "比较跳跃",
        "instruction": "切换到左右不相同的函数。",
        "preset": {
          "h": 0.01,
          "side": 1,
          "comparison": "jump"
        },
        "observation": "左侧一直为 1，右侧一直为 3；缩小距离也无法得到共同极限。"
      }
    ],
    "reflection": {
      "question": "单点改值和左右跳跃，为什么对极限的影响不同？",
      "answer": "改单点不改变去心邻域；跳跃使左右邻近输出趋向不同的数。"
    },
    "transferExerciseId": "limit-intuition-transfer"
  }
}
