{
  "id": "exponential-log",
  "chapterId": "functions",
  "number": "1.5",
  "title": "指数与对数",
  "subtitle": "倍增与反向寻找指数",
  "concept": "指数算“乘了多少次”；对数反过来问“要乘多少次，才能得到这个数”。",
  "intuition": "每次加同一个数是线性变化，每次乘同一个比例是指数变化。对数把乘法转成加法。",
  "objectives": [
    "底数与定义域",
    "运算法则与条件",
    "认识 $e$"
  ],
  "body": [
    {
      "title": "指数和对数接受哪些输入？",
      "text": "$b > 0$、$b \\ne 1$ 时，$b^{x}$ 对所有实数有定义，输出为正；$\\log _ b x$ 只接受 $x > 0$。$b > 1$ 时递增，$0 < b < 1$ 时递减。"
    },
    {
      "title": "对数可以怎样拆？",
      "text": "正数的乘积变成对数的和，商变成差，幂的指数可以提到前面。对数不能把加法拆开：$\\ln (x + y) \\ne \\ln x + \\ln y$。"
    },
    {
      "title": "为什么常用 $e$？",
      "text": "以 $e$ 为底时，指数函数的变化率等于自身；$\\ln$ 是它的反函数。一般底数会在导数中多出 $\\ln b$。"
    }
  ],
  "formalDefinition": {
    "text": "对数与指数互为反函数。",
    "latex": "\\log_b x=y\\iff b^y=x,\\qquad \\ln(e^x)=x",
    "conditions": [
      "$b > 0$，$b \\ne 1$，$x > 0$；$\\ln$ 是底数为 $e$ 的对数。"
    ]
  },
  "derivation": [
    {
      "text": "把正数 $u$、$v$ 写成指数。",
      "latex": "u=b^p,\\quad v=b^q"
    },
    {
      "text": "相乘相当于指数相加。",
      "latex": "uv=b^{p+q}"
    },
    {
      "text": "反向读出指数，得到对数乘法法则。",
      "latex": "\\log_b(uv)=\\log_bu+\\log_bv"
    }
  ],
  "interactiveVisual": {
    "kind": "graph",
    "function": "exp",
    "caption": "指数始终为正；拖动 $x$ 比较加一个单位时输出乘 $e$。",
    "prediction": "输入增加 1，输出是加 $e$，还是乘 $e$？用两个读数比较。"
  },
  "workedExamples": [
    {
      "title": "寻找指数",
      "problem": "解 $2^x=8$。",
      "steps": [
        "把 8 写成 $2^{3}$。",
        "同一底数的一一对应性质给出相同指数。"
      ],
      "answer": "$x = 3$。"
    },
    {
      "title": "带定义域解方程",
      "problem": "解 $\\ln(x-1)=2$。",
      "steps": [
        "先要求 $x > 1$。",
        "两边取指数，$x - 1 = e^{2}$，所得解满足定义域。"
      ],
      "answer": "$x=1+e^2$。"
    }
  ],
  "commonMistakes": [
    {
      "id": "exponential-log-m1",
      "claim": "认为 $\\ln(u+v)=\\ln u+\\ln v$。",
      "correction": "对数拆分适用于乘积，不适用于和。"
    },
    {
      "id": "exponential-log-m2",
      "claim": "在实数范围内计算 $\\ln (- 1)$。",
      "correction": "实对数的输入必须严格为正。"
    }
  ],
  "practice": [
    {
      "id": "exponential-log-p1",
      "difficulty": 1,
      "misconceptionTags": [],
      "problem": "求 $\\log_3 81$。",
      "answer": "$4$。",
      "solution": [
        "$3^{4} = 81$。"
      ],
      "hint": "问 3 的几次方等于 81。",
      "numericAnswer": 4
    },
    {
      "id": "exponential-log-p2",
      "difficulty": 1,
      "misconceptionTags": [],
      "problem": "化简 $\\ln(e^5)$。",
      "answer": "$5$。",
      "solution": [
        "$\\ln$ 与 $\\exp$ 撤销彼此。"
      ],
      "hint": "使用反函数关系。",
      "numericAnswer": 5
    },
    {
      "id": "exponential-log-p3",
      "difficulty": 1,
      "misconceptionTags": [
        "exponential-log-m2"
      ],
      "problem": "求 $\\ln(2-x)$ 的定义域。",
      "answer": "$x<2$。",
      "solution": [
        "要求 $2 - x > 0$。"
      ],
      "hint": "对数内部要严格为正。"
    },
    {
      "id": "exponential-log-p4",
      "difficulty": 2,
      "misconceptionTags": [],
      "problem": "在 $x>0$ 时，$\\ln(x^3)$ 等于什么？",
      "answer": "$3\\ln x$。",
      "solution": [
        "$x^{3}$ 是三个正数 $x$ 的乘积。"
      ],
      "hint": "应用乘积法则。"
    }
  ],
  "prerequisites": [
    "composition"
  ],
  "difficulty": 2,
  "misconceptionTags": [
    "exponential-log-m1",
    "exponential-log-m2"
  ],
  "provenance": {
    "author": "AI-generated",
    "version": "0.3.4",
    "status": "revised",
    "humanReviewed": false
  },
  "sources": [
    "openstax-calculus-1",
    "active-calculus-2",
    "ies-learning",
    "phet-design"
  ],
  "learningCheck": {
    "question": "$\\ln (e^{3})$ 等于多少？",
    "choices": [
      "$e$",
      "$3$",
      "$3 e$"
    ],
    "correctIndex": 1,
    "explanation": "$\\ln$ 与 $e$ 的指数运算互为逆运算：$\\ln (e^{x}) = x$。这里 $x = 3$。",
    "responses": [
      {
        "text": "自然对数问的是指数，不是底数。把答案代回：底数的几次方才是原来的数？",
        "experimentStep": 1
      },
      {
        "text": "$\\ln$ 与 $e$ 的指数运算互为逆运算：$\\ln (e^{x}) = x$。这里 $x = 3$。",
        "experimentStep": null
      },
      {
        "text": "指数表示重复乘法，不是把底数乘以指数。对数撤销的是指数运算。",
        "experimentStep": 2
      }
    ]
  },
  "teaching": {
    "explain": "指数增长把“每次加一样多”换成“每次乘一样多”。对数反过来数：达到某个输出需要走几步。",
    "steps": [
      {
        "title": "输入为零",
        "instruction": "输入取 0。",
        "preset": {
          "x": 0
        },
        "observation": "$e^0=1$。"
      },
      {
        "title": "增加一个单位",
        "instruction": "输入换成 1。",
        "preset": {
          "x": 1
        },
        "observation": "输出从 1 变成 $e$，约 2.71828。"
      },
      {
        "title": "再增加一个单位",
        "instruction": "输入换成 2。",
        "preset": {
          "x": 2
        },
        "observation": "输出为 $e^2$，约 7.38906；相邻输出的比仍为 $e$。"
      }
    ],
    "reflection": {
      "question": "输入每增加一，输出的差相同还是比相同？为什么？",
      "answer": "比相同。指数加一相当于再乘一次底数，不是加上同一个常数。"
    },
    "transferExerciseId": "exponential-log-p4"
  }
}
