{
  "id": "transformations",
  "chapterId": "functions",
  "number": "1.2",
  "title": "图像与变换",
  "subtitle": "公式里的移动，图上的移动",
  "concept": "图像变换就是改变每个点的坐标。先跟踪一个点，方向就不会记反。",
  "intuition": "在 $f (x - 2)$ 中，要让内层输入仍是 $u$，新的横坐标必须是 $u + 2$。所以图像向右移 2。",
  "objectives": [
    "水平与竖直平移",
    "伸缩与反射",
    "对称性与区间"
  ],
  "body": [
    {
      "title": "为什么减 $h$ 却向右移？",
      "text": "要让 $x - h$ 等于原来的输入 $u$，就得取 $x = u + h$。因此 $f (x - h) + k$ 把点 $(u , f (u))$ 移到 $(u + h , f (u) + k)$。"
    },
    {
      "title": "伸缩怎样看？",
      "text": "$Af(Bx)$ 把纵坐标乘 $A$、横坐标除以 $B$（$B \\ne 0$）。$A < 0$ 时上下翻转，$B < 0$ 时左右翻转；$|B|$ 越大，横向越压缩。"
    },
    {
      "title": "对称和增减怎样判断？",
      "text": "偶函数满足 $f (- x) = f (x)$，奇函数满足 $f (- x) = - f (x)$。增减要检查整个区间，不能只比较两点；断开的定义域要分开讨论。"
    }
  ],
  "formalDefinition": {
    "text": "若 $B \\ne 0$，原图上的点 $(u,f(u))$ 在下式中对应 $(\\frac{u}{B}+h,Af(u)+k)$。",
    "latex": "g(x)=A f(B(x-h))+k",
    "conditions": [
      "变换后的定义域也要跟着移动或伸缩。"
    ]
  },
  "derivation": [
    {
      "text": "令新函数内部的输入等于旧输入 $u$。",
      "latex": "B(x-h)=u"
    },
    {
      "text": "解出新横坐标，再变换输出。",
      "latex": "x=\\frac uB+h,\\qquad y=A f(u)+k"
    },
    {
      "text": "这条点映射比背“左加右减”更可靠。",
      "latex": null
    }
  ],
  "interactiveVisual": {
    "kind": "transform",
    "function": "square",
    "caption": "移动 $h$ 与 $k$，观察抛物线的顶点。",
    "prediction": "增大 $h$ 时，顶点向左还是向右？先预测，再拖动水平平移滑块。"
  },
  "workedExamples": [
    {
      "title": "顶点在哪里",
      "problem": "$g(x)=2(x-3)^2+1$ 的顶点、开口和最小值？",
      "steps": [
        "从 $y = x^{2}$ 开始，右移 3，纵向放大 2 倍，再上移 1。",
        "平方项非负，所以最小输出是 1。"
      ],
      "answer": "顶点 $(3,1)$，向上开口，最小值 1。"
    },
    {
      "title": "从点反推",
      "problem": "已知 $f(2)=5$，求 $g(x)=f(2x+2)-3$ 上对应的点。",
      "steps": [
        "令 $2 x + 2 = 2$，得 $x = 0$。",
        "输出等于 $5 - 3 = 2$。"
      ],
      "answer": "对应点是 $(0,2)$。"
    }
  ],
  "commonMistakes": [
    {
      "id": "transformations-m1",
      "claim": "把 $f(x-3)$ 向左移。",
      "correction": "跟踪内部输入：旧 $x = 0$ 对应新 $x = 3$。"
    },
    {
      "id": "transformations-m2",
      "claim": "认为 $2f(x)$ 与 $f(2x)$ 一样。",
      "correction": "一个改输出，一个改输入，通常不同。"
    }
  ],
  "practice": [
    {
      "id": "transformations-p1",
      "difficulty": 1,
      "misconceptionTags": [
        "transformations-m1"
      ],
      "problem": "$y=(x+2)^2-4$ 的顶点？",
      "answer": "$(-2,-4)$。",
      "solution": [
        "内部为零时 $x = - 2$，输出为−4。"
      ],
      "hint": "先找平方项为零的位置。"
    },
    {
      "id": "transformations-p2",
      "difficulty": 1,
      "misconceptionTags": [],
      "problem": "$g(x)=-f(x)$ 是哪种反射？",
      "answer": "关于 $x$ 轴反射。",
      "solution": [
        "每个点 $(x , y)$ 变成 $(x , - y)$。"
      ],
      "hint": "只有输出变号。"
    },
    {
      "id": "transformations-p3",
      "difficulty": 1,
      "misconceptionTags": [],
      "problem": "$f(x)=x^3$ 是奇函数还是偶函数？",
      "answer": "奇函数。",
      "solution": [
        "$f (- x) = - x^{3} = - f (x)$。"
      ],
      "hint": "代入 $- x$ 检查。"
    },
    {
      "id": "transformations-p4",
      "difficulty": 2,
      "misconceptionTags": [
        "transformations-m1"
      ],
      "problem": "$g(x)=\\sqrt{x-2}$ 的定义域？",
      "answer": "$[2,\\infty)$。",
      "solution": [
        "要求 $x - 2 \\ge 0$。"
      ],
      "hint": "定义域也会平移。"
    }
  ],
  "prerequisites": [
    "domain"
  ],
  "difficulty": 2,
  "misconceptionTags": [
    "transformations-m1",
    "transformations-m2"
  ],
  "provenance": {
    "author": "AI-generated",
    "version": "0.3.4",
    "status": "revised",
    "humanReviewed": false
  },
  "sources": [
    "openstax-calculus-1",
    "active-calculus-2",
    "ies-learning",
    "phet-design"
  ],
  "learningCheck": {
    "question": "$y = (x - 2)^{2}$ 的顶点在哪里？",
    "choices": [
      "$(-2,0)$",
      "$(0,2)$",
      "$(2,0)$"
    ],
    "correctIndex": 2,
    "explanation": "括号中的输入等于零时，函数最小。$x - 2 = 0$，所以顶点向右移到 $(2,0)$。",
    "responses": [
      {
        "text": "括号里的减号不是向左的指令。顶点处平方项为零，先解 $x-2=0$。",
        "experimentStep": 1
      },
      {
        "text": "输入里的平移改变横坐标；整个平方项外加常数才改变顶点高度。",
        "experimentStep": 2
      },
      {
        "text": "括号中的输入等于零时，函数最小。$x - 2 = 0$，所以顶点向右移到 $(2,0)$。",
        "experimentStep": null
      }
    ]
  },
  "teaching": {
    "explain": "平移改变的是点的位置。内部减去一个数时，要用更大的输入才能算到原来的位置，所以图像往右走。",
    "steps": [
      {
        "title": "从原图开始",
        "instruction": "水平和竖直平移都设为 0。",
        "preset": {
          "a": 0,
          "c": 0
        },
        "observation": "顶点在 $(0,0)$。"
      },
      {
        "title": "向右移动",
        "instruction": "水平平移设为 2，其他量保持不变。",
        "preset": {
          "a": 2,
          "c": 0
        },
        "observation": "$y=(x-2)^2$ 的顶点在 $(2,0)$。"
      },
      {
        "title": "再向上移动",
        "instruction": "保持水平平移 2，竖直平移设为 1。",
        "preset": {
          "a": 2,
          "c": 1
        },
        "observation": "顶点变为 $(2,1)$；两种平移改变不同坐标。"
      }
    ],
    "reflection": {
      "question": "横向右移与纵向上移，分别改公式的哪一处？",
      "answer": "横移改输入：用 $x-a$ 代替原输入；上移在整个输出外加常数。"
    },
    "transferExerciseId": "transformations-p4"
  }
}
